,username,rating,comment
0,117010097,9,nice looking and friendly to freshman.
1,3davoli,N/A,2017
2,8janek8,N/A,3T
3,agentpatman,7,"A lot lighter than we expected. Families with young teens or earlier would probably enjoy this. Nothing particularly bad it's just pretty light on strategy. Place gear, collect resource, repeat. Became a little more interesting when you can draft your gear instead of drawing. Sometimes you get lucky blocking an action which you could disguise as strategy. Great miniatures, but for us it's just little light on the decision making and doesn't provide enough fun in return like some other games."
4,ajewo,N/A,"Competitive hidden unit deployment game by Eric Lang (Blood Rage). Players secretly place their units on different locations to collect resources and do an action depending on the unit (agent).

+ Artwork
+ Components
+ Unusual Theme
+ Each player has his own upgradable engine which give player a direction to go
+ Easy to teach
# Saboteur unit to screw with other players

Similar games:
* Clockwork Wars (more complex, more depth, more variability, hard to teach)"
5,Alannamairead,8,"Jason & Janine's copy, pretty accessible fun, heaps of room to develop strategy"
6,alcofa,7,Simple and clever idea with the workers here. Great production in this one. 
7,Alex the Pretty Good,7,"Interesting worker placement strategy.
Has several game mechanics to track but after one game the logic just clicks.
Beautiful miniatures."
8,Altasia,N/A,Interested
9,ande9249,8,"Yes it is lighter, But the player powers does give just enough unbalancing to the game mechanics where each game does feel interesting. That said, most times you won't be able to leverage the player powers until around 25 min into the game. Which can be a lot to ask in a 60 minute game. "
10,Andr0ss,9,Based on my experience on playing the prototype alone I can say that this is an impeccable design. A great publisher will only curate this and flush out the graphics and component's but the design is solid and fantastic. I can't wait till its out on shelves. 161011
11,Andy Parsons,3,"Mixed production standards.  The building miniatures are nice and the plastic chips that are the players' workers have a good heft, though the bolt/copper plate chits are tiny.  The artwork is handsome and the rules are clear enough.  

Something appears to be missing, however.  An evil mastermind has stolen the excellent design that the combined talents of Lang and Bauza surely produced and replaced it with a simplistic exercise in worker placement and vp trawling."
12,annsk8r,3,"This game was poorly play-tested.  It was such a good concept, but really poorly executed."
13,awsiddons,N/A,Mind Games winner
14,axelian73,8.5,"French review as published on Trictrac (without pictures, see images section). 

Notre beau gros jeu de l’été dernier, il aura voyagé avec nous durant plusieurs semaines. En voiture et non en machine volante. Ceci dit on aura croisé une tarentule géante lors de nos balades. Et oh surprise, aucun article sur Trictrac, presque aucun avis…on pensait que c’était fait de longue date ! Allez on va se faire un plaisir de vous présenter ce bien beau jeu avec moults photos, on était en totale immersion victorienne durant l’été. Et autant le dire de suite, une fois le jeu sur la table, ça se joue en 35 minutes à 3 joueurs scoring inclus. 
Donc c’est beau ? Oui. Ambiance machines à vapeur d’un futur alternatif. Un thème clivant, souvent réservé à des jeux de niche pour spécialistes genre Dystopian Wars. Sauf que là c’est à destination des familles un peu joueuses et pas forcément aux joueurs velus. Ciblage pas forcément clair mais parti pris courageux. On se plaît à s’intéresser à cet univers décalé avec 6 beaux plateaux de machines bien détaillés aux salles farfelues, ces nombreuses figurines dont certaines nous parlent forcément, les méchants qui séquestrent des scientifiques…bref on est entrés dedans et ça nous a vraiment plu. Est-ce parce que notre néo-collégien lit « le château des étoiles » et qu’on a lu tous les Jules Verne étant jeunes ? 
Peut-être. Même quelques joueuses qui tiquaient en voyant la boîte ont finalement trouvé que oui, c’est plaisant et tellement gratifiant de jouer un jeu somme toute assez simple avec tout ce matériel qui fera pâlir certains projets KS au vu du rapport qualité prix ici imbattable (32 figurines dont 20 de belle taille au rendu mat superbe même sans peinture, honte à nous qui ne savons manier décemment le pinceau), un thermoformage façon organizer parfois coûteux…on se dit que les minuscules jetons fer/cuivre ne rentraient plus dans le budget, seul reproche côté matériel (remplacés chez nous par des kubenbois, voir photo).
Bref c’est aussi pour son univers graphique et son matériel qu’on apprécie jouer à ce jeu qui est somme toute « familial avancé » et non expert, si la science-fiction n’est pas votre truc du tout la présence visuelle imposante de ce jeu à table risque de ne pas trop plaire. 

Bon, visuellement c’est top, mais comment on joue ?
Tout simplement en posant des engrenages (= des ouvriers spécialisés). 
La moitié du temps de jeu est une succession de placements de ces engrenages-personnages sur l’une des villes disponibles, à tour de rôle. Face cachée évidemment. 
La pose du 3ème personnage sur une même ville déclenche une résolution et histoire de ne pas perdre le fil du tour, le joueur ayant déclenché cette résolution prend un pense bête devant lui, le « monocle de l’oubli ». Bien utile c’est vrai. 
La résolution des actions c’est donc la seconde moitié du temps de jeu à peu de choses près. 
Dans un premier temps, chaque disque offrira à son possesseur le butin de la ville concernée. Si les autres joueurs vous laissent placer 3 disques sur la même ville, ce qui arrive parfois, et bien vous rafflez 3 fois la récompense. 
Voici les butins disponibles : 
Londres : 1 jeton cuivre (pour faire sa machine)
Moscou : 1 en plus sur l’échelle de puissance de feu (histoire de pouvoir capturer des bâtiments)
Paris : 1 scientifique (utiles seuls ou par lots pour jouer un tour de plus ou chiper un bâtiment)
Rome : 1 codex (échelle de bonification additionnelle + possibilité de choisir le disque qu’on pose dès qu’on détient 5 codex plutôt que de jouer le coup suivant. Bien pratique donc)
Washington : 1 jeton fer (pour faire sa machine)

Ensuite on retourne la pile de 3 disques et on applique les effets des agents dans l’ordre. 

Voici enfin les capacités des agents : 
Le saboteur annule le jeton suivant (sauf de sa propre couleur). Rageant parfois, aléatoire souvent, le jeu en devient familial, même un bon tacticien ne pourra rien contre plusieurs saboteurs. 
On rappelle toutefois que tous les agents même annulés récupèrent quand même le butin de la ville.
L’acolyte récupère une seconde fois le butin de la ville. 
L’homme de main tente d’accomplir la mission actuellement présente dans cette ville. Il prend la carte si le pré-requis est validé et on ne remet pas de carte avant la fin du tour.  
L’artilleuse récupère un bâtiment à condition que votre puissance de feu soit suffisante (égale ou supérieuse à ce qu’indique la flèche). 
L’ingénieur déclenche le pouvoir de votre machine maléfique. 

Les machines justement, c’est un peu le petit côté asymétrique léger du jeu : les six proposées dans le jeu sont différentes visuellement et assez loufoques mais diffèrent surtout par le pouvoir apporté sur action de l’ingénieur. Elles orientent également certains choix lors de la partie : on aura davantage de cartes missions validées avec l’une, des ressources rapides avec une autre, des actions multiples avec une troisième…
On conseille un sachet zip par machine histoire d’éviter le bazar dans la boîte.
Un pouvoir de base est disponible pour chaque machine dès le début du jeu et 2 autres peuvent se débloquer en construisant les pièces adaptées. 
Construire un segment de machine c’est tout simple : une fois le bon nombre de jetons fer et cuivre posés sur cette section hop vous récupérez la tuile adaptée et défaussez les ressources. Chaque segment aura son utilité : puissance de feu augmentée, ressources récupérées, davantage de scientifiques stockables sur son plateau, PV supplémentaires à la fin…
Petite parenthèse : on a vite été dérangés par la minuscule taille des jetons fer/cuivre recto/verso. On préfère utiliser sur ce coup-là de bons vieux cubes, pas d’erreur en les manipulant. Gris, doré, posé terminé. 
En résumé, les machines se construisent grâce à 2 ressources de base. Le jeu se termine quand une machine est terminée (on fait alors un dernier tour et on résout tout ce qui traîne sur les villes). 
2 ressources seulement ? Oui, simple et efficace, on rappelle que cela reste selon nous un jeu familial. 
Les ressources s’obtiennent soit par le butin de 2 villes, soit par la capture de certains bâtiments (mais cela fait monter le niveau des services secrets), soit par le pouvoir de certaines machines. 

Trois dernière petites choses : 
1/ selon le bâtiment capturé (par l’homme de main par exemple ou par un trio de scientifiques), un bonus est récupéré. C’est l’une des façons d’obtenir 1 ressource + 2PV en fin de partie car chaque bâtiment vaudra 2 PV. Les monuments capitales offrent un jeton 2PV et aucune ressource.
2/ Les scientifiques permettent de rejouer un disque défaussé, de jouer un tour supplémentaire ou de capturer un bâtiment selon qu’on en défausse 1, 2 ou 3.
3/ Les missions disponibles influent sur le choix de jouer certains agents ou de capturer divers monuments. 
En fin de partie, le scoring prend en compte 5 domaines :  les PV des segments construits sur la machine, les codex, les missions, les jetons PV et les bâtiments. 
Le jeu se joue souvent à peu de choses, deux missions ou quelques codex de plus…Il y a beaucoup d’interactions « indirectes » via le plateau, on ne se vole rien et on ne se combat pas. Un peu trop gentils ces méchants donc, pas de crispation à table d’ailleurs sauf quand on se fera saboter pour la troisième fois de suite. Alors vous l’aurez deviné on aime beaucoup y jouer malgré quelques déconvenues au départ avec les règles, le jeu est flatteur et offre pas mal de choix simples. Ceci dit son positionnement n’est pas évident (très peu de retours d’ailleurs) car très typé par son thème et trop léger pour des joueurs chevronnés. Par contre en famille avec des ados, ça glisse tout seul et on laisse aisément le matériel sur la table dédiée plusieurs jours de suite car la mise en place et le rangement prennent un peu de temps malgré la boîte bien pensée. 
4 choses à bien prendre en compte : 
1/ La machine GRIFFE est trop puissante si on utilise ce qui est imprimé sur le plateau de cette machine. Il faut utiliser ce qui est écrit dans la règle (1.0 ou 1.1) à savoir qu’en activant la machine (via l’ingénieur), un joueur place immédiatement son prochain agent sous un agent du plateau central qui se trouve SEUL dans une ville. On ne déclenche donc pas de résolution en cascade en glissant sans arrêt un agent sous des piles de 2 agents comme nous l’avons joué un bon moment….
2/ L’utilisation de 3 scientifiques vous permet de capturer un bâtiment (si vous être ok au niveau puissance de feu). Vous gagnez alors le bonus lié à CE bâtiment spécifique et non pas le butin de la ville dont il provient. 
3/ Partout on figure un jeton PV (tête de mort + une valeur) il faut uniquement regarder la valeur indiquée. La tête de mort ne vaut pas 2 PV elle-même…quand une carte indique 3, c’est donc 3 PV et non pas 6 qu’on récupère (doute levé durant l’été dernier). Tous les petits jetons PV valent 2. 
4/ Quand on réussit une mission on récupère uniquement la carte mission de la ville, mais pas de jeton PV. La valeur indiquée sur la carte se suffira à elle-même en fin de partie lors du décompte.
Pour nous c’est entre 8 et 9 selon les critères BGG, on aime et on le recommande, on a été bavards sur ce coup ! Et petit clin d’œil pour finir à une BD de ce genre un peu particulier mais bien sympathique !"
15,BastardCafe,N/A,2 912
16,bayspiel,N/A,05.02.02.03
17,bobpazjr,7,"This one brings some cool mechanisms together. Very enjoyable for the whole family. Kiddos definitely love it (age 7-12), and we've had some great fun introducing it to friends. There are a couple thematic/backstory holes I'd love to see filled, but I can't complain. This one's been a winner for us!"
18,Bond8089,5,"This is a strange production.  The game feels WAY overproduced, with all of the building miniatures seeming completely irrelevant.  They are cool... don't get me wrong, but they feel way out of place.  The artwork is also cool, but there is zero theme to this game... its all just a standard euro with some pretty art.  The game was fun to play, and I wouldn't mind playing again, but its not something I would ask to play."
19,brettspieletreff,1,"Die Gebäude stinken selbst nach Wochen noch. Das doppelseitig bedruckte Hauptspielmaterial (Chips) ist viel zu klein, die Gebäude sind zwar groß, werden aber nur einmal im Spiel gebraucht, wenn sie gestohlen werden und stehen sonst nur rum."
20,brewsaki,6,"Interesting but unexciting game. Overproduced for what it is. I mean, the buildings are basically 2-point tokens. There is 25 of them, 7 different models, all plastic... seriously? I kind of like the stacking of the chips but I feel like resolving the actions later breaks the flow of the game."
21,Briancph,7.5,"+ Turns are quick and simple
+ Gameplay is a mix of tactics and strategy. You have to play the first worker you draw from your stack but once you achieved 5 books in your library you may choose which worker to play. You have to time the placement and activation of your workers in various locations so they resolve optimally (especially if you're playing with less than 5 books in your library). 
+ Some memory and bluffing aspect as workers are placed face-down. You have to guess where opponents' saboteur is which cancels out your worker's ability.
+ Saboteur mechanic really shines and increases excitement of the game while introducing a good level of take that. 
+ Multiple scoring opportunities from stealing buildings to missions to constructing your machine.
+ Variable player powers. 

- Production is great with the minis but the bolts and plates chits are miniscule. They want to keep the player board size manageable but it is a mismatch in quality when there are miniatures scientists when those could have easily been tokens. Double layered player boards would have been nice with the plates and bolts being cubes that can slot in. 
- I initially thought each villain was linked to a particular machine but apparently they were just illustrations. Would have been nice to see some kind of backstory to increase immersion.
- Rulebook could have been clearer and needs a section for each of the machines unique powers.

A solid light to mid weight game that pleases across the board with a little bit of everything and does not overstay its welcome."
22,buffcoat,N/A,"The minis are perfect. Everything else is, meh. Thin player boards, extremely fiddly and tiny pieces. A deeper than expected worker placement/engine builder than I thought it would be. "
23,caelet,N/A,cool minis
24,calidoggg,8,"So far, I really enjoy this game.  I love the delayed action resolution mechanism and the stacking.  It has some challenging decisions along the way, but doesn't overstay its welcome and seems fairly balanced.  The asymmetric machine powers are the greatest part of the game for me, though.  Without that, I wouldn't rate this as high as an 8."
25,CannonFodderTed,7.9,"I actually really liked this game. Fun gameplay, great components, doesn't overstay its welcome. I really love the mechanic of placing your cogs face down as it makes for some very interesting decisions and also has that ""I hope my opponent doesn't do this"" feeling which keeps the game tense. Quite a good little gem which I think is probably overlooked this year."
26,cbazler,5.5,"A couple nice ideas here, but the game is almost too simple for me. The bluffing/blind worker-placement works to a degree, but not with two players, when it's too easy to track and remember player tokens: it often becomes obvious which tokens are traps, and it can stall the game if both players simply avoid those spots. I also think the game is slightly too repetitive to reward multiple plays: it seems the only real interest is in the complex interactions of multiple players."
27,Celtic Joker,8,"I'm not a Worker Placement fan at all!
But this one is fun for me because you always have enough workers and you can always go to any space. It's just a matter of choosing which worker (they have different abilities) to send to which space."
28,Chabousse,6,"Very interesting ""Chips programming"" mechanic. Played the prototype and the published game, not convinced."
29,charlest,6.4,"I'm not a fan of worker placement but the adoption of the StarCraft-like system really jazzes this up. There's a bit of chaos and direct conflict (sabotage) that really alleviates some of my pain points with the classic mechanism.

I also dig how you're building doomsday devices and unlocking special powers and attributes. This just feels great and ties in wonderfully with the absolutely breezy gameplay. Everything moves extremely fast and it's not overly thinky or analytical. It's a gateway+ worker placement game that's streamlined but still interesting with a touch of flavor.

------------------------------------
Full review: https://geekandsundry.com/build-your-own-doomsday-device-in-victorian-masterminds/"
30,Cheelara1,8,"I really loved playing this game. It was lots of fun, a def keeper"
31,Chez Geeks,8,Our Video: https://www.youtube.com/watch?v=t4hd0P6oCTA
32,ChildeRoland1919,6.6,"Steampunk is not usually my kinda theme but...I must admit the mini buildings, agent tokens and tableau building ties together in what is a nice package. The saboteur can add a little take that but in the spirit of the game works fine, especially since everyone has the ability. All in all this one plays quick and there are plenty of decisions to keep everyone involved. A nice surprise. (NOT RECOMMENDED AS A 2PLAYER GAME)"
33,Chindestructible,8,"A fun theme and a quick, combo heavy worker placement."
34,Christine Biancheria,8,This is way better than people initially gave it credit for.
35,Chrono12,7,Rulebook is seriously underdeveloped and leaves a lot of questions unanswered. Otherwise a quality title.
36,Chu_Junyu,7,A nice workplacement game.Easy too learn but not fool.
37,cliffmikard,2,Awful.  Abandoned after two turns by four very experienced gamers.  Two stars for the plastic components (but use them elsewhere)!
38,Cogliostro,6,"Seichtes ""Programmier""-Spiel"
39,ColinWA,9,"Simple play mechanism, but rich and deep strategic options to pursue. Greatly enjoyed this ingenious game."
40,Cone Defense,6,Something about this just didn’t work for me. Interesting design with some ok decisions. The social pet just didn’t have enough to offset the boring decisions.
41,cutesnottie,N/A,"Essen 2018?
worker placement"
42,danarickle,7.4,"Fun game that doesn't play well at 2 (no balancing mechanism for a very possible game-play issue). Good player interaction. Definitely good for a fun, competitive, light/medium game."
43,DarioAggioli,6.49,Simpatico 
44,Deacis,6.5,"Mechanically tight and balanced game, but a bit too soulless/abstract for me. Got the same feeling after playing The Godfather: Corleone's Empire from CMON."
45,dizlike,N/A,"Till försäljning 250:-
Vikt 1400 gram. 95:- frakt.
Nationella gruppen."
46,djnesq,7,"In the way so many options are packed into a short playing time, the game reminds me of 7 Wonders. A good memory and an ability to predict opponents' placements help."
47,doctoryes0,5,Are you bgg-stalking me Anthony?
48,domcrap,7.5,"Great components and art. Interesting Euro game, but with some non-targeted screwage. This creates a tense chaotic feeling layered on a straightforward point salad game.  The structure of the game is very clean, so gameplay flows quickly and without much confusion. The theme is silly fun (destroying cities and causing mayhem) as opposed to what you’d normally find in this type of euro game (something erudite). Overall, a very solid design."
49,dpbernath,3,Dice Tower West 2019
50,DrWorm331,9,"Great game, components and storage tray. Very fun!"
51,DTLibrary,N/A,Shelf 3
52,DTWLibrary,N/A,10C
53,Duesler,N/A,3.15
54,duncanid,N/A,I'm Board
55,echoingvoice,N/A,Need to review
56,Emmdizzle24,6.5,Not very good with 2
57,emperormark,6,Another much-hyped and overrated collaboration between CMON and Eric Lang. So-So.
58,ericbinnyc,N/A,Haven't gotten to the table yet.
59,ErsatzDragon,N/A,Definitely want to check out its twist on worker placement.  :)
60,Eryck333,7,np
61,evkefalas,N/A,-Premium Sleeved Kaissa (Mayday) 41x63
62,Fabio0907,7,7.5
63,FaceBreaker,N/A,"Holy Grail
Lang X Bauza
"
64,FelTha,N/A,Localização: C1
65,fenikspl,6,"The game is well produced and the first few plays will most likely be fun, but once the novelty factor wears off, there's not much else left. "
66,fisha,6,"A két szerzőt talán kedvenceimnek mondhatom, így nagyon nagy várakozásaim voltak. Pláne, hogy általában szeretem a közepes hosszúságú, egyszerű, de fineszes játékokat. Hát ehhez képest elég nagy csalódás volt. Pont amiért kedves nekem e két szerző, az nem fellelhető ebben a játékban. AZ ő játékaik mindig letisztultak, kerek egészet alkotnak. Ez sajnos nagyon nem. Az egésznek olyan fura, nehezen megfogható félkész érzése van."
67,Flora_S,N/A,Multiplayer only.
68,fraterurbs,N/A,2017
69,fredm,7.5,"3 games played.
All players enjoyed the game.
Good game for 60 minutes play with a ""family"" group."
70,fromeea,N/A,"In Box #0078
Cards Sealed"
71,galin54,N/A,WTP Med. Worker placement game by Antoine Bauza and Eric Lang. Workers placed face down have individual powers.
72,Games CLUB,7,Owned by: Dan
73,GarfieldKlon,8,"29.4

I really like this game. The mechanism with discs is very nice. The only thing I dislike is that someone can luckily copy an engineer and start his engine and get a lot of stuff. That's also what happened in our play, and this person won. Some of the individual characters are overpowered?

[c]
Theme:          :star::star::nostar::nostar::nostar: [size=7]Little[/size]
Gameplay:       :star::star::star::star::nostar: [size=7]Good amount of choices[/size]
Interaction:    :star::star::star::nostar::nostar: [size=7]Where the others placing their disc[/size]
Artwork:        :star::star::star::nostar::nostar: [size=7]Good[/size]
Luck:           :star::star::star::nostar::nostar: [size=7]Revealing of the discs[/size]
Strategy:       :star::star::nostar::nostar::nostar: [size=7]Not much possibilities[/size]
Components:     :star::star::star::nostar::nostar: [size=7]Discs are perfect, the rest could be better[/size]
Play duration:  :star::star::star::star::star: [size=7]Perfect[/size]
Easy to teach:  :star::star::star::nostar::nostar: [size=7]Ok[/size]
Rules quality:  [size=7]not read[/size]
Setup time:     :star::star::star::nostar::nostar: [size=7]Ok[/size]
No downtime:    :star::star::star::star::nostar: [size=7]Plays very quick[/size]
Replay value:   :star::star::star::nostar::nostar: [size=7]Different individuals[/size]
[/c]"
74,Geekway,N/A,"Finefield, MM, 12-16-2019"
75,GiaLaRoc,8,"Mécanique atypique qui m'a beaucoup plus! On place des tuiles face cachée sur le monument de notre choix et quand il y a une pile qui fait une taille de 5, on retourne la pile et on résout les actions possible.
"
76,Gionte76,8,2 - 4
77,glsonn,N/A,Sure hope this makes it this time. I will need to add it to my Victorian room.
78,Gornack,N/A,5
79,gotrek987,7,"An interesting game. On the one hand, it looks and feels great. On the other hand, it is more confusing than it has to be at first and is way overproduced. Overall, it is a decent game that plays fairly quick. The theme is also decent enough to inspire an occasional devious laugh when you trump your fellow masterminds. Stacked worker placement mechanics can be tough to figure out, but this one handles it well. The progression from building up your secret weapon of mass deviousness is handled PERFECTLY. Things to watch out for: The Saboteur, is really just not fun. The randomness of placements usually from the agents means that randomly you will just outright lose a turn. This is tough no matter the play count. 2 players its brutal, more players and you might lose a couple agents in a row. It's not a long game and it's not entirely uneven so it is not the end of the world, but I can easily see some people having issues with it. The other thing is C.L.A.W.S. . . . . I don't know HOW this thing was playtested. If you do use it, please use the variant offered by Eric Lang. Having the engineer's ability used to hop from stack to stack, is just broken. Even with the fix it is pretty unbalanced over the other abilities, but much better than without."
80,Govy 66,7,"Relatively simple, quick & fun worker placement game. A novel twist on the genre."
